rule,education
qualifications associate degree ,1
accredited college or university ,1
accredited college or university ,1
at least a bachelor degree,1
ba bs degree in a related,1
bachelor degree and years work experience,1
bachelor degree ba bs,1
bachelor degree in a,1
bachelor degree or equivalent,1
bachelor degree skills,1
bs ba degree in related field,1
bs degree or equivalent,1
bs or ms degree,1
college degree programs,1
degree required bachelor degree,1
education and experience bachelor degree,1
education bachelor degree,1
education from accredited colleges,1
education level bachelor degree,1
experience bachelor degree ,1
experience bachelor degree and years,1
foreign colleges or universities,1
from an accredited college or university,1
minimum degree required bachelor degree,1
must be a graduate of an accredited,1
needed ba bs degree,1
needed bachelor degree,1
nursing degree,1
preferred undergraduate degree,1
preferred undergraduate degree or equivalent,1
qualifications bachelor degree,1
technical degree bachelors masters,1
technical degree bachelors masters or phd,1
associate degree and or diploma,1
experience high school diploma,1
qualifications high school,1
national certification or high school,1
minimum level of education high school,1
high school education,1
high school degree ged ,1
high school degree,1
ged equivalent,1
full time degree preferred high school,1
experience knowledge high school,1
experience high school diploma,1
experience high school diploma,1
education high school diploma,1
education high school ,1
education high schhol experience,1
education experience high school,1
education and experience high school,1
diploma or general education development ged,1
diploma or general education degree ged,1
diploma or general education degree,1
diploma or ged,1
diploma or equivalent,1
diploma ged,1
degree required high school,1
a high school degree,1
diploma ged with years of experience,1
experience high school diploma,1
experience high school diploma,1
general education degree ged,1
high school degree,1
high school qualification,1
preferred high school degree ged,1
certification or pharmacy license,1
doctoral degree in nursing,1
has doctoral degree,1
pharmacy license,1
master degree in nursing,1
bs or ms degree,1
needed bachelor degree,1
bachelor degree or equivalent,1
education from accredited colleges,1
bs degree or equivalent,1
bachelor degree in a,1
preferred undergraduate degree,1
education level bachelor degree,1
from an accredited college or university,1
qualifications bachelor degree,1
at least a bachelor degree,1
must be a graduate of an accredited,1
needed ba bs degree,1
bachelors degree experience,1
experience or a bachelor,1
